customer_sentiment,urgency,resolution_status,trajectory,rationale,call_id
,0.3,resolved,stable,"Internal pre-launch checklist meeting with positive team energy, minor Safari bug being addressed same-day, all major items on track for April 7th launch with no blockers.",01KQCF9872BF130D33B1B5EC
,0.75,open_with_plan,deteriorating,"Team identified critical scalability issues (47-min queue times) requiring 6-8 weeks to fix properly, with only band-aid throttling available short-term while sales pushes growth—creating tension between known technical debt and business pressure after recent credibility damage from March outage.",01KQD1270E98A7DFC55ADCF8
0.7,0.1,open_with_plan,improving,"Customer started skeptical but is now satisfied despite a March outage, praising communication/fixes and showing interest in expanding to Identity module at renewal.",01KQD199788883B6F18C81E8
0.6,0.3,open_with_plan,stable,"Customer is highly satisfied with current products (Comply/Protect) and excited about v2 features, showing genuine interest in Detect upsell despite transparency about recent incident; renewal conversation is progressing positively with no major concerns raised.",01KQD4D9DEBA2D55AC2AA9F5
-0.3,0.85,open_with_plan,improving,"Customer started very frustrated about 3-day outage affecting HIPAA compliance but became more cooperative after Priya acknowledged Aegis fault, offered immediate manual backup workaround, and committed to written incident documentation for audit purposes.",01KQDD5172176D02DB51360A
,0.85,open_with_plan,improving,Internal post-mortem after a critical 6-hour customer-facing outage; team moved from frustration about known risks being deprioritized to concrete action items with owners and timelines.,01KQE110900B8A65D80AE694
-0.7,0.95,open_with_plan,stable,"Customer remains highly frustrated about platform outage and competitive evaluation, but accepted escalation process and committed to receiving incident report rather than threatening immediate cancellation.",01KQEDB92E33CF9945A7F71B
-0.3,0.7,open_with_plan,improving,"Customer started frustrated (second issue in weeks, evaluating competitors) but Sarah's acknowledgment of failures, concrete two-part fix, and timeline reduced tension from ~-0.6 to -0.3 by call end.",01KQEDE682B4A8D67C657CF1
,0.1,resolved,stable,"Internal retrospective celebrating successful completion of reliability sprint with team morale high, clear documentation/knowledge-sharing plans established, and proactive next steps identified for continued improvement.",01KQF9600A904ADE8605B3F0
,0.2,resolved,improving,"Internal team confidently completing SOC 2 Type II audit prep with clear timeline, resolved concerns about March outage documentation, and positive sentiment about new Comply v2 tooling eliminating previous pain points.",01KQFEEFFF8E80B0DFD10880
0.7,0.3,open_with_plan,improving,"Customer (Julia/Blackridge) entered satisfied with platform performance and became more positive when learning about upcoming Comply v2 features, though renewal terms haven't been finalized yet and follow-up documentation on the January incident was promised.",01KQFFC0F889AE8CFEE7A00D
